{"M_state":{"description":"当前仅能登记用户报告的绝对命题，不能登记该组织的实际工作状态。","evidence_refs":["USER-A1"],"uncertainties":["没有组织内基线、时间序列或岗位分层。"]},"Psi_state":{"description":"信任的体验—意义状态未被直接提供，不能由远程地点替代。","evidence_refs":["USER-A1"],"uncertainties":["缺少低权力位置、新人和管理者的可比反馈。"]},"action_limits":["本模型只分析与预测条件，不产生现实处置命令。"],"actor_records":[{"actor_id":"ACTOR-UNSPECIFIED-ORGANIZATION","inference_limits":["只保留分析角色，不能把用户断言转成组织事实。"],"inferred_state":["不能由一句绝对命题推断该组织的稳定文化或管理人格。"],"label":"未指明组织","observed_state":["材料未提供组织规模、岗位结构、现有制度或测量结果。"],"roles":["待识别的安排与责任主体"]},{"actor_id":"ACTOR-UNSPECIFIED-EMPLOYEES","inference_limits":["不得从地点安排推断个人忠诚、能力或动机。"],"inferred_state":["成员间存在差异是待检验假设，而非已知分组事实。"],"label":"未指明成员位置","observed_state":["材料未报告任何成员的信任体验、退出、绩效或申诉记录。"],"roles":["可能受远程安排影响的员工、新人和管理者位置"]}],"authorization_limits":["任何试验、制度调整、退出或救济都需由适格主体另行授权并接受独立复核。"],"circle_candidates":[{"circle_id":"CIRCLE-TEAM-CANDIDATE","label":"团队候选圈层","membership_basis":["未提供成员清单；仅以可能共享工作接口的团队作为待验证候选。"],"reification_risks":["不能把候选团队当作同质实体，也不能把其成员偏好视为一致。"]},{"circle_id":"CIRCLE-ORGANIZATION-CANDIDATE","label":"组织候选圈层","membership_basis":["用户提及组织信任，但未给出组织边界、部门或授权范围。"],"reification_risks":["不得把组织标签替代岗位、流程和责任链记录。"]}],"clocks":[{"clock_id":"CLOCK-EVIDENCE-CUTOFF","current_time":"2026-07-23T00:00:00+08:00","horizon":"P6M","label":"证据截止时钟","lag":"P1M"}],"events":[{"description":"用户报告“远程办公一定会摧毁组织信任”的绝对因果断言；该报告不是组织内观测事实。","event_id":"EVENT-USER-ASSERTION","event_type":"reported","evidence_refs":["USER-A1"],"time":"2026-07-23T00:00:00+08:00"}],"evidence_cutoff":"2026-07-23T00:00:00+08:00","experiential_meaning_channel":{"observables":["公平感、可解释性、被支持感、关系安全感"],"state":["组织信任被主张为结果，但没有量表、访谈或互动证据。"],"unknowns":["成员如何理解远程安排、监控、评价和归属"]},"identity_criteria":[{"criterion":"把组织信任与地点安排分开登记。","test":"同一岗位、团队和时间窗中同时记录安排、沟通接口、评价程序与信任测量，才可比较。"}],"locked_at":"2026-07-23T08:30:00+08:00","material_channel":{"observables":["协作接口、响应延迟、任务依赖、评价与申诉记录"],"state":["远程办公的地点、时序、文档和协作工具安排均未被具体描述。"],"unknowns":["安排频率、岗位可远程性、工具可达性和资源差异"]},"object_boundary":{"in_scope":["远程办公安排、组织信任、岗位差异、团队级沟通与反馈条件"],"name":"远程办公对组织信任的影响","object_id":"OBJ-REMOTE-TRUST","out_of_scope":["未给出的特定组织、个人品质、绩效结果、永久制度授权"]},"phase_id":"P3","residuals":[{"description":"“一定会摧毁”是待检验的全称命题，现有材料不能吸收为事实。","handling":"保留为中心命题并以竞争机制、反例和撤回条件约束判断。","residual_id":"RESIDUAL-USER-ABSOLUTE"}],"run_id":"promax-run-dd7c57f21d368fd0","scale_profile":{"excluded_scales":["未提供的行业总体规律","个人稳定人格"],"focal_scale":"团队与岗位接口","included_scales":["个人互动","团队协作","组织制度"],"transformation_limits":["团队观察不能直接推出组织总体信任；需要明确岗位、时间窗与测量转换。"]},"schema_id":"crossframe.promax.v8.local-world-model","schema_version":1,"source_snapshot_sha256":"3186805a3e46e1b16948a4e51d08e7693a8e0dd04aa6b4604e796266d649936c","unknowns":[{"decision_impact":"没有基线就不能区分地点变化、治理变化和既有差异。","question":"远程安排改变前后，组织信任及其岗位差异的基线是什么？","retrieval_plan":"在不惩罚参与者的前提下，收集分岗位重复测量、申诉和协作接口记录。","unknown_id":"UNKNOWN-BASELINE"},{"decision_impact":"不同路径会改变试探、保护或停止条件的排序。","question":"影响来自关系接触损失、治理可见性，还是新人社会化与岗位依赖？","retrieval_plan":"比较团队级早期信号、反向信号和退出条件，而不把一般研究套为个案结论。","unknown_id":"UNKNOWN-CAUSAL-PATH"}]}
