{"M_state":{"description":"当前只知道议题涉及远程办公，不能据此断言任何具体物质条件已经改变。","evidence_refs":["USER-MATERIAL-1"],"uncertainties":["具体空间、时间、设备、照护与资源分布全部未知"]},"Psi_state":{"description":"当前只知道用户主张组织信任会被必然摧毁，该主张是报告内容而非已观察状态。","evidence_refs":["USER-MATERIAL-1"],"uncertainties":["信任基线、对象、成员差异、测量与因果方向未知"]},"action_limits":["仅形成条件性解释、路径信号与低信息方案比较","不得把外部平均效应写成当前组织事实或个体人格"],"actor_records":[{"actor_id":"ACTOR-AUTHORIZED-DECISION-MAKER","inference_limits":["材料未识别真实主体、权限、地域或期限，当前仅为可解析的待审引用"],"inferred_state":[],"label":"待确认的组织决策主体","observed_state":[],"roles":["远程办公安排的潜在审查者","责任与救济链的待确认承接者"]},{"actor_id":"ACTOR-EMPLOYEE","inference_limits":["不得由办公地点推断动机、忠诚或稳定人格"],"inferred_state":[],"label":"员工位置","observed_state":[],"roles":["远程安排参与者","协作与信任变化的受影响位置"]},{"actor_id":"ACTOR-MANAGER","inference_limits":["不得把角色要求或一次行为升级为个人特质"],"inferred_state":[],"label":"管理者位置","observed_state":[],"roles":["反馈与资源协调者","制度解释和修复责任的潜在承担者"]},{"actor_id":"ACTOR-NEWCOMER","inference_limits":["新人处境是待测异质性，不是预设缺陷"],"inferred_state":[],"label":"新人低权力位置","observed_state":[],"roles":["社会化与学习通道的受影响成员","弱联系变化的高暴露位置"]}],"authorization_limits":["本轮不授权现实试验、监测、岗位处置、退出安排或数据收集","任何高影响行动都需另行识别主体、授权来源、管辖、期限和独立复核"],"circle_candidates":[{"circle_id":"CIRCLE-TEAM","label":"任务团队候选圈层","membership_basis":["由共同任务、反馈接口和可观察成员关系暂定"],"reification_risks":["团队均值不能替代个人位置，成员边界需由组织事实复核"]},{"circle_id":"CIRCLE-CROSS-TEAM","label":"跨团队弱联系网络候选圈层","membership_basis":["由跨团队互动、桥接关系和事件流暂定"],"reification_risks":["共同数字平台不自动构成直接关系或统一主体"]},{"circle_id":"CIRCLE-ORGANIZATION","label":"组织制度候选圈层","membership_basis":["由规则、岗位、责任、申诉和资源分配接口暂定"],"reification_risks":["组织信任不能被实体化为一个拥有心智的整体"]}],"clocks":[{"clock_id":"CLOCK-INTERACTION","current_time":"2026-07-23T00:00:00+08:00","horizon":"P90D","label":"互动与关系预期时钟","lag":"P7D"},{"clock_id":"CLOCK-ORGANIZATION","current_time":"2026-07-23T00:00:00+08:00","horizon":"P1Y","label":"组织制度与岗位调整时钟","lag":"P30D"}],"events":[{"description":"用户报告其认为远程办公一定会摧毁组织信任，并说明材料只有这句话。","event_id":"EVENT-USER-ASSERTION","event_type":"reported","evidence_refs":["USER-MATERIAL-1"],"time":"2026-07-23T00:00:00+08:00"}],"evidence_cutoff":"2026-07-23T00:00:00+08:00","experiential_meaning_channel":{"observables":["关系预期","公平评价感知","发声安全","身份与合法性感知"],"state":["组织信任被用户作为待检验结果提出，但没有基线、重复测量或成员叙述"],"unknowns":["信任对象","群体差异","测量工具","变化时间窗"]},"identity_criteria":[{"criterion":"若信任对象、组织边界、办公制度或时间窗实质改变，则不再视为同一分析对象。","test":"逐项比对对象名、成员与角色、办公形式、信任测量、时间窗和 J 轴。"}],"locked_at":"2026-07-23T00:10:00+08:00","material_channel":{"observables":["同步与异步互动比例","跨团队接触","设备可用性","协调时间"],"state":["办公空间、时间、设备、照护、协作机会与资源成本均未获个案材料"],"unknowns":["岗位依赖","照护约束","地理分布","当前办公制度"]},"object_boundary":{"in_scope":["远程或混合办公安排与员工、管理者、新人之间的可观察协作、反馈、弱联系和信任变化","团队、跨团队网络与组织制度之间的尺度转换及 M/Ψ 双通道条件","材料仅含用户提出的“远程办公必然摧毁组织信任”待检验命题"],"name":"远程办公对组织信任的影响","object_id":"OBJ-REMOTE-TRUST","out_of_scope":["未提供的具体组织、岗位、国家法规、实施期限和既有信任基线","由一次互动直接推断稳定人格或由平均表现替代低权力位置","从分析、预测或方案排序自动生成现实授权"]},"phase_id":"P3","residuals":[{"description":"用户的确定性姿态可能来自未披露经验，也可能只是待检验直觉，当前模型无法吸收。","handling":"保持为来源明确的报告，不把姿态当证据；若补充事实则重开 P3。","residual_id":"RESIDUAL-ATTITUDE"}],"run_id":"promax-green-v3-gpt-5-6-sol-a1-f2bde4ebcefa435fbf4be12cf278730b","scale_profile":{"excluded_scales":["国家法规与宏观劳动力市场的个案裁决","具体企业实施决策"],"focal_scale":"以团队互动为焦点，向个人位置、跨团队网络和组织制度作受限迁移","included_scales":["个人与角色位置","任务团队","跨团队网络","组织制度","互动、组织与长期累积时钟"],"transformation_limits":["沟通频率、弱联系、绩效或留任不能无映射地等同组织信任","外部研究只限定机制可行性，不能替代当前组织基线","观察范围扩大不提升 J 轴授权范围"]},"schema_id":"crossframe.promax.v8.local-world-model","schema_version":1,"source_snapshot_sha256":"3186805a3e46e1b16948a4e51d08e7693a8e0dd04aa6b4604e796266d649936c","unknowns":[{"decision_impact":"决定是否存在变化及变化强度，能够推翻地点即原因的零模型。","question":"组织信任的对象、基线、量表与重复测量是什么？","retrieval_plan":"按员工、管理者、新人和团队分层建立变化前基线与重复测量。","unknown_id":"UNKNOWN-BASELINE"},{"decision_impact":"决定弱联系、互动时钟与可逆性路径的排序。","question":"远程办公是全远程、混合、临时还是自愿安排？","retrieval_plan":"冻结办公比例、自愿性、期限、任务互赖和同步要求。","unknown_id":"UNKNOWN-WORK-FORM"},{"decision_impact":"区分治理中介机制与地点本身的解释。","question":"文档、反馈、公平评价、申诉和修复写回质量如何？","retrieval_plan":"审计反馈延迟、责任可见性、申诉结果和报复风险。","unknown_id":"UNKNOWN-GOVERNANCE"},{"decision_impact":"决定弱联系损失机制是否反超。","question":"跨团队弱联系、新人桥接与非正式线索如何变化？","retrieval_plan":"在保护隐私的前提下比较网络桥接、反馈来源与新人学习机会。","unknown_id":"UNKNOWN-NETWORK"},{"decision_impact":"决定任何方案能否越过分析上限进入现实程序。","question":"谁在何种地域、期限和授权来源内可审查远程安排？","retrieval_plan":"另行核验真实决策主体、授权记录、管辖、有效期和独立复核。","unknown_id":"UNKNOWN-AUTHORIZATION"}]}
