{"M_state":{"description":"物质与制度条件未知，不能判断远程安排的资源和监控结构。","evidence_refs":[],"uncertainties":["岗位可远程程度","协作工具","评价与监控制度"]},"Psi_state":{"description":"只观察到用户立场，未观察任何具体组织成员的信任状态。","evidence_refs":["INPUT-A2"],"uncertainties":["同事信任","主管信任","组织信任","心理安全"]},"action_limits":["只能提出补证、保护性改进和可逆试探的条件","不能从外部研究直接命令具体组织返岗或永久远程"],"actor_records":[{"actor_id":"ACTOR-A2-STATEMENT-HOLDER","inference_limits":["不能从语气推断其组织、岗位、利益、经历或证据","“绝不会”是姿态而非经验材料"],"inferred_state":[],"label":"立场陈述者","observed_state":["只提供了关于远程办公与组织信任的一句话立场"],"roles":["提出“绝不会”判断"]}],"authorization_limits":["分析不产生现实行动授权","授权主体、来源、管辖与期限均未解决"],"circle_candidates":[{"circle_id":"CIRCLE-A2-ORGANIZATION","label":"待识别组织及其团队","membership_basis":["只有问题中的“组织”名词，成员与边界未知"],"reification_risks":["不能把不同岗位、团队与权力位置压成同质整体"]}],"clocks":[{"clock_id":"CLOCK-A2-UNSPECIFIED","current_time":"2026-07-23T00:00:00+08:00","horizon":"P0D","label":"未指定分析时窗","lag":"P0D"}],"events":[],"evidence_cutoff":"2026-07-23T00:00:00+08:00","experiential_meaning_channel":{"observables":["输入句中的“绝不会”"],"state":["用户表达了绝对否定风险的姿态"],"unknowns":["员工、管理者、新人的实际信任体验与表达安全"]},"identity_criteria":[{"criterion":"同一组织信任命题必须区分组织、主管与同事信任。","test":"若结果量或对象层级改变，则重建命题而不视为同一指标。"},{"criterion":"远程、混合和全员强制远程不是同一干预。","test":"若办公频率、自愿性或治理制度不同，则分别登记。"}],"locked_at":"2026-07-23T08:50:00Z","material_channel":{"observables":[],"state":["没有组织内资源、绩效、监控或岗位配置事实"],"unknowns":["技术条件","工作依赖","监控强度","资源分配"]},"object_boundary":{"in_scope":["远程或混合办公形式与组织信任之间的条件关系","沟通、监控、协作网络、自主性与新人社会化等候选通道","员工、管理者与新人位置上的潜在差异"],"name":"远程办公对组织信任的影响","object_id":"OBJ-A2-REMOTE-TRUST","out_of_scope":["未提供名称的具体组织已经发生的事实判断","所有行业、岗位、国家和时间窗的无条件外推","任何现实主体的行动授权"]},"phase_id":"P3","residuals":[{"description":"外部研究覆盖的工作形式、岗位、时期和结果变量并不相同。","handling":"只用于否定绝对命题和形成候选机制，不作为个案行动排序证据。","residual_id":"RESIDUAL-A2-HETEROGENEITY"}],"run_id":"promax-green-v4-gpt-5-6-sol-a2-9742973771c64e89813a768c7894faa8","scale_profile":{"excluded_scales":["国家劳动力市场","所有行业总体"],"focal_scale":"组织—团队—岗位关系","included_scales":["个人位置","团队协作","组织制度"],"transformation_limits":["个人体验不能无映射外推为组织信任","单一企业研究不能直接外推为所有组织"]},"schema_id":"crossframe.promax.v8.local-world-model","schema_version":1,"source_snapshot_sha256":"3186805a3e46e1b16948a4e51d08e7693a8e0dd04aa6b4604e796266d649936c","unknowns":[{"decision_impact":"决定能否识别变化方向与幅度。","question":"具体组织在调整办公安排前的组织、主管与同事信任基线是什么？","retrieval_plan":"分岗位、团队、任期和权力位置做匿名基线与重复测量。","unknown_id":"UNKNOWN-A2-BASELINE"},{"decision_impact":"决定风险来自办公地点还是治理与任务设计。","question":"沟通质量、跨团队桥接、监控、自主性和新人支持中哪个通道实际变化？","retrieval_plan":"预注册指标并比较可逆试探前后，同时保留反事实或对照。","unknown_id":"UNKNOWN-A2-MECHANISM"},{"decision_impact":"决定建议能否从分析进入现实执行。","question":"谁有权在何种管辖与期限内改变办公安排？","retrieval_plan":"独立核验授权来源、J 轴范围、期限与申诉机制。","unknown_id":"UNKNOWN-A2-AUTHORIZATION"}]}
